Date,Tweet
10/8/2020,"Donald Trump has made hate, division, and dog whistles central to his campaign from the very beginning - and last week he couldn't even condemn white supremacists. It's a pattern."
10/8/2020,"Let me be clear: A Biden-Harris Administration won't increase taxes by a dime on anyone making less than $400,000 a year."
10/8/2020,".@KamalaHarris is showing the American people why I chose her as my running mate. She's smart, she's experienced, she's a proven fighter for the middle class. She'll be an incredible Vice President."
10/7/2020,"Folks, I know a thing or two about vice presidential debates.  In 2008, I squared off against Governor Palin. And in 2012, I called out Congressman Ryan's malarkey.  I know @KamalaHarris will do a great job. Join me and tune in at 9 PM ET to cheer her on."
10/7/2020,"As president, I will:  - Implement nationwide mask mandates - Ensure access to regular, reliable, and free testing - Accelerate the development of treatments and vaccines  I won't waste any time getting this virus under control."
10/6/2020,"Make no mistake: if you are out of work, if your business is closed, if your child's school is shut down, if you are seeing layoffs in your community, Donald Trump decided today that none of that matters to him."
10/6/2020,"I give you my word: If I am elected president, I will marshal the ingenuity and goodwill of this nation to turn division into unity and bring us together."
10/6/2020,"As president, I will embrace:  Hope, not fear. Peace, not violence. Generosity, not greed. Light, not darkness.   I will be a president who appeals to the best in us. Not the worst."
10/6/2020,"We fought a Civil War that would secure a Union that would seek to fulfill the promise of equality for all.  And by fits and starts, our better angels have prevailed just enough against our worst impulses to make a new and better nation.  Those better angels must prevail again."
10/6/2020,The pandemic is not a red state versus blue state issue. The virus doesn't care where you live or what political party you belong to.  It infects us all. It will take anyone's life. It is a virus - not a political weapon.
10/6/2020,I do not believe we have to choose between law and order and racial justice in America.
10/6/2020,"As president, I will send a clear, unequivocal message to the entire nation: There is no place for hate in America.  It will be given no license. It will be given no oxygen. It will be given no safe harbor."
10/6/2020,Unity over division.
10/6/2020,"Folks, we can save nearly 100,000 lives by the end of the year if everyone wears a mask in public.  Do your part. Protect your neighbors. Wear a mask."
10/6/2020,Listen to the scientists.
10/6/2020,I view wearing a mask as a patriotic duty - to protect those around you. #BidenTownHall
10/6/2020,Masks matter. They save lives.
10/5/2020,"Now that President Trump is busy tweeting campaign messages, I would ask him to do this: Listen to the scientists. Support masks. Support mask mandates nationwide."
10/5/2020,Imagine a future where:  - Health care is a right - We end the gun violence epidemic - We combat climate change - Our government works for everyone  It's a future that we can build - together.
10/4/2020,Before we're Democrats or Republicans or independents - we're Americans.  We can't forget that.
10/4/2020,30 days.
10/4/2020,"At this moment, we're facing unprecedented crises. But I know the American people have what it takes to overcome them.  There's not a single thing beyond our capacity."
10/3/2020,"It's time we come together.  It's time we see each other as fellow Americans, who don't just live in red states and blue states, but who live in - and love - the United States of America.  That's who we are - and there is nothing we cannot do if we do it together."
10/3/2020,"One month until Election Day. Let's do this, America."
10/3/2020,"Be a patriot. Do your part.  Wearing a mask will protect you. But it will also protect those around you - your mom, your dad, your son, your daughter, your neighbor, your co-worker.  Don't just do it for yourself. Do it for the people you love."
10/2/2020,"I'm running as a Democrat, but I will be an American president. Whether you voted for me or against me, I will represent you."
10/2/2020,"We can, we will, and we must come together."
10/2/2020,This cannot be a partisan moment.  It must be an American moment.  We have to come together as a nation.
10/2/2020,"I'm happy to report that Jill and I have tested negative for COVID. Thank you to everyone for your messages of concern. I hope this serves as a reminder: wear a mask, keep social distance, and wash your hands."
10/2/2020,Jill and I send our thoughts to President Trump and First Lady Melania Trump for a swift recovery. We will continue to pray for the health and safety of the president and his family.
10/2/2020,"Donald Trump will do everything he can to distract from the fact that because of his failed COVID-19 response:  - Over 200,000 Americans have died - 26 million are on unemployment - 1 in 6 small businesses risk permanent closure  We can't let him."
10/1/2020,"When I first ran for Senate, we put up a billboard that said, Joe Biden: For all our families.  It's a motto that has guided me throughout my career.  It doesn't matter if you're a Democrat or Republican-I'll be a president for "
10/1/2020,"During Filipino American History Month, we celebrate the community's immense contributions to our country - from early immigrants to the millions today, many who serve in the military or as frontline workers. As President, I'll work alongside them to protect the American people."
10/1/2020,"Three years ago today, Las Vegas was struck by tragedy when a gunman opened fire on the Route 91 Harvest Festival. It remains the deadliest mass shooting in modern U.S. history.  As we remember those we lost, we must take action to ensure it never happens again."
10/1/2020,Jill and I wish a happy Mid-Autumn Festival to all those celebrating. We join you in hoping for a future filled with peace and prosperity - and hope your festivities lead to a bountiful harvest in the year ahead.
10/1/2020,"On behalf of Jill and our entire family, I want to wish the Korean-American community a happy Chuseok. May your celebrations be filled with laughter, joy, and plenty of good food. \xed\x96\x89\xeb\xb3\xb5\xed\x95\x9c \xed\x95\x9c\xea\xb0\x80\xec\x9c\x84 \xeb\xb3\xb4\xeb\x82\xb4\xec\x84\xb8\xec\x9a\x94!"
10/1/2020,Last night reinforced why I got into this race: We are in a battle for the soul of this nation - and it's a battle we must win.
9/30/2020,White supremacy has no place in America.  We shouldn't have to beg the President of the United States to say that.
9/30/2020,You heard a lot come out of President Trump's mouth. Can you name one thing he said to actually make your life better?
9/30/2020,"Under this president, we've become weaker, sicker, poorer, more divided, and more violent."
9/30/2020,Donald Trump isn't a law and order president. He's a president who breaks the law and creates disorder.
9/30/2020,"Show us your tax returns, @realDonaldTrump."
9/30/2020,Donald Trump is the worst president we've ever had.
9/30/2020,"When I hear 200,000 deaths, I think of the empty chairs at dining room tables all across the country, which just months ago were filled by loved ones.  It didn't have to be this bad."
9/30/2020,It is what it is because Donald Trump is who he is.
9/30/2020,"President Trump keeps promising to protect Americans with pre-existing conditions, but the truth is he's in Court trying to rip their protections away.  And now, he's trying to jam through the confirmation of a Justice who will help him get it done.  We can't let him win."
9/29/2020,"If we're elected, @KamalaHarris and I will wake up every single morning to fight for the middle class. For Main Street. For the folks who keep our country running.  We're going to make our government work for everyone - not just the wealthy and well-connected."
9/29/2020,The American people understand the urgency of this moment. They're voting in droves because their health care hangs in the balance.  But Donald Trump doesn't care - he sees a chance to eliminate Obamacare and rip away health care protections from millions.  It's unconscionable.
9/28/2020,"I'm not looking to punish anyone, but it's about time the super-wealthy and corporate America start paying their fair share."
9/28/2020,President Trump can claim he wants to protect people with pre-existing conditions all he wants - but the fact is he's fighting tooth and nail to take their protections away.
9/28/2020,There's no mystery when it comes to what's happening with the Supreme Court. President Trump and Republicans have been trying to throw out Obamacare for years - and now they see an opening to get it done.  We can't let them get away with it.
9/27/2020,"On this Gold Star Mother's and Family's Day, Jill and I are keeping the loved ones of our fallen heroes in our prayers. May we never fail to honor them and carry their spirit with us every day."
9/27/2020,The truth is the economy wasn't working for folks long before these crises hit. It's why @KamalaHarris and I won't just build back to the way things were - we'll build back better. We won't be satisfied until the economy starts working for every
9/26/2020,The Senate shouldn't vote until the American people do.
9/26/2020,"Supreme Court decisions affect our everyday lives, and the Constitution was designed to give voters a voice on who makes those decisions.  The Senate shouldn't act until after the American people select their next president and the next Congress.  Americans deserve to be heard."
9/26/2020,"When Ebola hit, President Obama and I took swift action and successfully contained the virus.  After COVID-19 hit, President Trump lied to the American people and said it would miraculously ""disappear.""  Now, over 200,000 lives have been cut short.  It\'s a national tragedy."
9/26/2020,"At this moment, we're facing both the worst public health crisis of our lifetime and the existential threat of climate change.  We need a president who believes in science."
9/26/2020,"If I'm elected, I won't wait to take action on COVID-19.  Minutes after the race is called, I'll call Dr. Fauci and ask him to stay on.  During my transition, I'll bring together experts and leaders from both parties to chart a path forward.  We will overcome this, together."
9/25/2020,"The unrelenting impact of climate change affects every single one of us.  It requires action, not denial. It requires leadership, not scapegoating.  It requires a president to meet the threshold duty of the office - to care, for everyone."
9/25/2020,Health care is a right - not a privilege.
9/25/2020,"In the middle of a global pandemic, President Trump is trying to get the U.S. Supreme Court to eliminate Obamacare and rip health care protections away from 100 million Americans with pre-existing conditions.  Don't forget that."
9/24/2020,"Once again, we are called to ask ourselves whether justice could be equally applied in America. But what's clear is that today in America, Black women deserve better."
9/24/2020,"In-person early voting should be easy and convenient for all. The Flint, MI City Clerk's office will be open the last three weekends before Election Day for folks to cast their ballots. It's an example that cities and states across the country should follow."
9/24/2020,"On this Feast Day of Our Lady of Mercy, I stand in solidarity with all defenders of human rights from Cuba, Nicaragua, and Venezuela - and pray for the freedom of all political prisoners."
9/24/2020,"Even amidst the profound grief ; anger today's decision generated, violence is never ; can never be the answer. Those who engage in it must be held accountable. Jill ; I are keeping the officers shot tonight in Louisville in our prayers. We wish them both a swift ; full recovery."
9/22/2020,"Donald Trump sees the world from Park Avenue.  I see the world from where I grew up: Scranton, Pennsylvania."
9/22/2020,"200,000 Americans have died from this virus.  It's a staggering number that's hard to wrap your head around. But behind every COVID-19 death is a family and community that will never again be the same.  There's a devastating human toll to this pandemic - and we c"
9/22/2020,"Today, we'll pass another grim milestone in this pandemic: 200,000 American lives lost.  Jill and I are keeping everyone who's hurting in our prayers. No words can numb your pain, but know the nation grieves with you.  Today is dark, but we will overcome this. Keep the faith."
9/22/2020,"Donald Trump ran for office saying he would represent the forgotten men and women of this country - and as soon as he got in office, he forgot about us."
9/22/2020,"When the virus came, President Trump wasn't thinking about you, he was thinking about his own reelection.  It's how Trump looks at the world: It's always about him, never about us.  You deserve a president who will put you first."
9/19/2020,We must win.
9/19/2020,"Let me be clear: The voters should pick a President, and that President should select a successor to Justice Ginsburg."
9/19/2020,"Ruth Bader Ginsburg stood for all of us. She was an American hero, a giant of legal doctrine, and a relentless voice in the pursuit of that highest American ideal: Equal Justice Under Law. May her memory be a blessing to all people who cherish our Constitution and its promise."
9/18/2020,"Jill and I wish our friends in the Jewish community a very healthy and happy New Year. As we mark this new beginning, let us commit to pursuing peace and justice in the year ahead. #RoshHashanah"
9/18/2020,"When we needed Donald Trump to tell the truth about COVID-19, he lied to us.  When we needed him to take action to contain its spread, he spent his days golfing.  When we needed a president the most, he was nowhere to be found.  It's unforgivable."
9/18/2020,This election is Scranton vs. Park Avenue.
9/17/2020,"Donald Trump wants to give his rich friends another tax cut, so they pay a lower tax rate than tens of millions of essential workers and middle class Americans.  We need a president who cares about more than the wealthy and well-connected."
9/17/2020,"The 100 richest Americans have made more than $300 billion during the COVID-19 crisis.   Now, in the middle of a pandemic and economic crisis, Donald Trump wants to give them a $29 billion tax break.   Let that sink in."
9/17/2020,"If you make under $400,000, you will not pay a penny more in taxes when I'm president.  The super-wealthy and big corporations will finally pay their fair share - and we'll invest that money in working families.  We're going to reward work - not wealth."
9/17/2020,"We've had to endure President Trump's incompetence and dishonesty when it comes to testing, wearing masks, and socially distancing.    We can't afford a repeat of those fiascos with a COVID-19 vaccine.  The stakes are too high."
9/17/2020,We're going to get this virus under control and get your life back on track.
9/16/2020,"We've lost nearly 200,000 Americans to COVID-19.   It didn't have to be this bad - but Donald Trump failed to do his job."
9/16/2020,"Donald Trump not only suggested we sell or trade Puerto Rico - but he also left our fellow Americans without the resources they desperately needed after Hurricane Maria. It's unacceptable.  As president, I'll support the island's full recovery and invest in its people and future."
9/15/2020,"As we celebrate the Independence Day of Costa Rica, Guatemala, El Salvador, Honduras and Nicaragua, we must affirm the democratic aspirations and human rights of people across Latin America.  I'll always fight for democracy and for those who come to America seeking a better life."
9/15/2020,"The 16th Street Baptist Church bombing is a powerful reminder of our past and what remains at stake in this election. As we honor the memory of those four little girls, we must commit to defeating the poisonous ideology of white supremacy that lit the fuse 57 years ago."
9/15/2020,"This morning, parents all across the West - already worried about their kids being indoors because of COVID-19 - are now also waking up worried about their kids being outside.  We need a president who takes climate change seriously."
9/14/2020,".@realDonaldTrump, you know what's actually threatening our suburbs?  Wildfires. Floods. Hurricanes.  We need to act on climate. Now."
9/14/2020,50 days.
9/14/2020,Weapons of war have no place in our communities.  We need to ban assault weapons and high-capacity magazines.
9/13/2020,"26 years ago today, the Senate passed 10-year bans on assault weapons and high-capacity magazines-it was an effort I was proud to champion.  These bans saved lives, and Congress should have never let them expire.  As president, I'll take on the @NRA and we'll ban them once "
9/12/2020,You deserve a President and Vice President who will spend every minute of every day working to make your life better.  I promise that's exactly what @KamalaHarris and I will do.
9/11/2020,Donald Trump said he wanted to be a cheerleader for the country. We didn't need a cheerleader. We needed a president.
9/10/2020,Donald Trump said he didn't want to tell the truth and create a panic. So he did nothing and created a disaster.
9/9/2020,You deserve a president who tells you the truth.
9/9/2020,"If Donald Trump had acted just two weeks earlier, 54,000 lives could have been spared in March and April alone.   Instead, he downplayed the threat and refused to take action - costing lives and sending our economy into a tailspin.  It's an unjustifiable dereliction of duty."
9/9/2020,"I promise you that if I'm elected, I'll always tell you the truth.  I'll listen to the experts and do everything I can to contain this virus.  And I'll always put your health and safety first - no matter the political cost."
9/9/2020,"A safe and effective COVID-19 vaccine could save countless lives. We need one as soon as possible.  But while I see a vaccine as a product of science, President Trump sees it as a political tool.  Politics should play no role in this. The Administration must answer the following:"
9/9/2020,Donald Trump is incapable of providing the leadership this moment requires.
9/8/2020,This economy may be working great for Donald Trump and his wealthy friends - but it's not working for the rest of America.  It's time we change that.
9/8/2020,"At our best, America has always been generous, kind, and optimistic. We treat each other with dignity, give hate no safe harbor, and leave no one behind.  I believe we can be that nation once again."
9/7/2020,Wall Street didn't build this country - the middle class did. And unions built the middle class.  Donald Trump doesn't understand that. We need a president who does.
9/7/2020,"It's not enough to just thank our essential workers - we need to pay them. As president, I'll:  - Raise the minimum wage to $15 - End the tipped minimum wage - End the sub-minimum wage for people with disabilities - Ensure everyone has strong benefits"
9/7/2020,"For years, President Trump and Republicans have waged a war on America's labor unions.   It will end on my watch.  I'll sign the PRO Act - making it easier for workers to organize and collectively bargain - and be the strongest labor president workers have ever had."
9/7/2020,The 40-hour workweek Minimum wage Overtime pay Health care  Workplace safety protections  They're all because of unions - and it's time we recognize that.
9/7/2020,We need to restore honor and decency to the White House.
9/6/2020,"Donald Trump promised to be ""the greatest jobs president God ever created.""  But in reality, he\'s on track to become the first president in modern history to leave office with fewer jobs than when he entered.  American workers can\'t take four more years of his failed leadership."
9/6/2020,It's time we reward work - not just wealth.
9/5/2020,"As president, I will:  - Call for nationwide mask mandates - Implement widespread testing - Accelerate the development of treatments and vaccines  I'm ready to work on day one to contain the spread of this virus and get our country back on track."
9/4/2020,I'm grateful for everyone who found work in August and found that glimmer of hope - but there is real cause for concern in this morning's jobs report.  The pace of job gains in August was slower than in July. And significantly slower than May or June.
9/3/2020,"Right now, classrooms should be humming with excitement for a new year and students' hopes for their futures.  Instead, many are silent and empty because President Trump didn't do his job.  America's families are paying the price for his failures."
9/3/2020,"I've always believed we're at our best when we act as one America. It's time for us to come together, propel our nation across this turbulent threshold, and build a better future for all."
9/2/2020,Donald Trump and Betsy DeVos are the worst possible people to lead our nation's schools through this pandemic.
9/2/2020,Last month we raised $364.5 million - 95% of the donations from grassroots supporters like you and the majority online.  Working people are powering our campaign - and I'm grateful.  We've got a long way to go to close the fundraising gap and win - bu
9/1/2020,.@DrBiden and I send our best wishes to members of the Jain faith concluding the holy observance of Paryushan and Das Lakshan. May we all find peace and reconciliation in our lives. Michhami Dukkaddam and Kshamavani!
9/1/2020,"Across the country, people rely on public transportation to get to work, see loved ones, and access essential services. But that's all under threat because Republicans refuse to do their jobs.  Congress must act now to save public transit."
9/1/2020,"Tonight, President Trump declined to rebuke violence.  He wouldn't even repudiate one of his supporters who is charged with murder.  He is too weak, too scared of the hatred he has stirred to put an end to it."
8/31/2020,More cops have died from COVID this year than have been killed on patrol.  Nearly one in six small businesses in this country are closed.  Do you really feel safer under Trump?
8/31/2020,"Donald Trump keeps telling us if he was president, you'd feel safe.  Well, he is president - whether he knows it or not."
8/31/2020,Trump and Pence are running on this: You won't be safe in Joe Biden's America.  And what's their proof?  The violence you're seeing in Donald Trump's America.
8/31/2020,"The simple truth is Donald Trump failed to protect America. So now, he's trying to scare America."
8/31/2020,"I want a safe America - safe from COVID, safe from crime and looting, safe from racially motivated violence, safe from bad cops.   And let's be crystal clear: Safe from four more years of Donald Trump."
8/31/2020,"Donald Trump may believe mouthing the words law and order makes him strong, but his failure to call on his own supporters to stop acting as an armed militia in this country shows you how weak he is."
8/31/2020,Does anyone believe there will be less violence in America if Donald Trump is reelected?
8/31/2020,We are facing so many crises under Donald Trump:   COVID. Economic devastation. Unwarranted police violence. Emboldened white nationalists. A reckoning on race. Declining faith in a bright American future.  The common thread? A president who makes things worse - not better.
8/31/2020,"here's a lot happening, but I hope we don't overlook the brave fire fighters ; emergency responders in the wake of Hurricane Laura.  When the storm hit, they stayed behind-even while their homes were being destroyed-to help their community recover.  True Ame"
8/29/2020,I believe there's not a single thing the American people can't accomplish if we do it together. We're going to overcome these crises and emerge stronger than before.
8/29/2020,We have a president more interested in beating people at golf than beating COVID-19.
8/29/2020,"The true power of @ChadwickBoseman was bigger than anything we saw on screen. From the Black Panther to Jackie Robinson, he inspired generations and showed them they can be anything they want - even super heroes. Jill and I are praying for his loved ones at this difficult time."
8/29/2020,America was built on a simple idea: All men - and women - are created equal.   It's time we ensured all people are treated equally as well.
8/28/2020,"As we mark the 57th anniversary of the March on Washington and Dr. Martin Luther King Jr.\'s ""I Have a Dream"" speech, we must continue the hard work of perfecting our union. It\'s up to all of us to carry on the march toward equality, liberty, and justice for all."
8/28/2020,"We can't let George Floyd and Jacob Blake become just another pair of hashtags.  This is a moment of action.  It's long past time we reform policing, reverse systemic racism, and make our communities safer."
8/28/2020,Remember: every example of violence Donald Trump decries has happened on his watch. Under his leadership. During his presidency.
8/28/2020,"From the moment COVID-19 emerged, President Trump downplayed the threat it posed, refused to listen to the experts, and failed to take action to contain its spread.  Now, we're paying the price."
8/28/2020,"Donald Trump calls himself a wartime president. But now, instead of leading the charge to defeat this virus, he's waved the white flag.  He abandoned the American people when we needed him most."
8/28/2020,"- 180,000 lives lost - Nearly 6 million confirmed cases of COVID-19 - Over 25 million Americans out of work - Countless small businesses on the brink of closing  That's Donald Trump's America. We're living it every day. We can't take four more years."
